{
  "version": 1,
  "generatedAt": "2026-09-02T18:12:00Z",
  "requestId": "req_fixture_empty_events",
  "defaultTeamId": "team_offseason_1",
  "teams": [
    {
      "id": "team_offseason_1",
      "name": "Wildcats",
      "displayName": "Wildcats",
      "ageGroup": "9U",
      "season": "Fall",
      "year": 2026,
      "sport": "baseball",
      "role": { "code": "admin", "label": "Team Admin / Head Coach" },
      "capabilities": [
        "team.view", "team.manage", "membership.manage",
        "roster.view", "roster.manage",
        "schedule.view", "schedule.manage",
        "lineup.view", "lineup.create", "lineup.manage", "lineup.lock",
        "game.view_mode", "game.start_mode",
        "scoring.view", "scoring.claim", "scoring.record", "scoring.finalize"
      ],
      "nextEvent": null,
      "readiness": { "rosterCount": 10, "confirmedCount": 0, "lineupStatus": "none", "lineupId": null },
      "actions": [
        { "id": "view_schedule", "label": "View Wildcats schedule", "href": "/app/teams/team_offseason_1/schedule", "enabled": true, "disabledReason": null },
        { "id": "view_roster", "label": "View Wildcats roster", "href": "/app/teams/team_offseason_1/roster", "enabled": true, "disabledReason": null }
      ]
    }
  ]
}
