{
  "version": 1,
  "generatedAt": "2026-09-02T18:12:00Z",
  "requestId": "req_fixture_one_team",
  "defaultTeamId": "1774297491626",
  "teams": [
    {
      "id": "1774297491626",
      "name": "Mud Hens",
      "displayName": "Mud Hens",
      "ageGroup": "8U",
      "season": "Fall",
      "year": 2026,
      "sport": "baseball",
      "role": { "code": "admin", "label": "Team Admin / Head Coach" },
      "capabilities": [
        "team.view", "team.manage",
        "membership.manage",
        "roster.view", "roster.manage",
        "schedule.view", "schedule.manage",
        "lineup.view", "lineup.create", "lineup.manage", "lineup.lock",
        "game.view_mode", "game.start_mode",
        "scoring.view", "scoring.claim", "scoring.record", "scoring.finalize"
      ],
      "nextEvent": {
        "id": "game_123",
        "type": "game",
        "opponent": "Braves",
        "startsAt": "2026-09-02T22:00:00Z",
        "location": "Riverside Field",
        "homeAway": "home"
      },
      "readiness": {
        "rosterCount": 11,
        "confirmedCount": 9,
        "lineupStatus": "ready",
        "lineupId": "lineup_456"
      },
      "actions": [
        {
          "id": "start_game_mode",
          "label": "Start Mud Hens Game Mode",
          "href": "/app/teams/1774297491626/games/game_123/mode",
          "enabled": true,
          "disabledReason": null
        },
        {
          "id": "view_roster",
          "label": "View Mud Hens roster",
          "href": "/app/teams/1774297491626/roster",
          "enabled": true,
          "disabledReason": null
        },
        {
          "id": "view_schedule",
          "label": "View Mud Hens schedule",
          "href": "/app/teams/1774297491626/schedule",
          "enabled": true,
          "disabledReason": null
        }
      ]
    }
  ]
}
